{
  "action": "switch-main",
  "blocked_because": [
    "worktree_not_clean"
  ],
  "boundary": {
    "does_not_authorise_actions": true,
    "does_not_execute": true,
    "does_not_mutate": true
  },
  "checked_at": "2026-05-30T12:00:00Z",
  "checks": [
    {
      "actual": "switch-main",
      "check": "plan_action_supported",
      "expected": "switch-main",
      "passed": true
    },
    {
      "actual": "plan-example-switch-main-blocked",
      "check": "proof_plan_ref_matches_plan",
      "expected": "plan-example-switch-main-blocked",
      "passed": true
    },
    {
      "actual": "switch-main",
      "check": "proof_plan_action_matches_plan",
      "expected": "switch-main",
      "passed": true
    },
    {
      "actual": "d09c6c97848bdb04adbe8183c77e36ac1cd43172fb1faff16d62f96bf24b01e8",
      "check": "proof_plan_content_sha256_matches_plan",
      "expected": "d09c6c97848bdb04adbe8183c77e36ac1cd43172fb1faff16d62f96bf24b01e8",
      "passed": true
    },
    {
      "actual": "present",
      "check": "repo_toplevel_known",
      "expected": "non-empty repo_toplevel",
      "passed": true
    },
    {
      "actual": "present",
      "check": "current_branch_known",
      "expected": "non-empty current_branch",
      "passed": true
    },
    {
      "actual": "main",
      "check": "default_branch_is_main",
      "expected": "main",
      "passed": true
    },
    {
      "actual": "false",
      "check": "worktree_clean",
      "expected": "true",
      "passed": false
    },
    {
      "actual": "true",
      "check": "remote_main_fresh",
      "expected": "true",
      "passed": true
    },
    {
      "actual": "true",
      "check": "ownership_ok",
      "expected": "true",
      "passed": true
    }
  ],
  "failure_reasons": [
    "worktree_not_clean"
  ],
  "plan_ref": "plan-example-switch-main-blocked",
  "proof_ref": "switch-main-proof-example-blocked-dirty-001",
  "readiness_id": "switch-main-readiness-d6f35897a55ae6fe455e4d2a1e94d972b74f8bb44518ec14361b5f585f56dbf1",
  "repo_toplevel": "/home/alex/code/heimgewebe/infra",
  "schema_version": "switch-main-readiness.v1",
  "source_refs": [
    "git.rev_parse.toplevel",
    "git.current_branch",
    "git.default_branch_candidate",
    "git.status.porcelain",
    "git.ahead_behind",
    "git.remote.origin.url",
    "local_config.canonical_repo_roots",
    "action-plan.v1",
    "switch-main-preflight-proof.v1"
  ],
  "status": "blocked"
}
